{
  "version": "1.0",
  "source": {
    "platform": "showit",
    "sourceUrls": [
      "https://fitzgerald.tonicsiteshop.com/"
    ],
    "baseUrl": "https://fitzgerald.tonicsiteshop.com/",
    "extractionMode": "live-dom",
    "artifacts": [
      {
        "type": "html",
        "path": "scrapes/fitzgerald-tonicsiteshop-com/home/html/rendered.html"
      },
      {
        "type": "screenshot",
        "path": "scrapes/fitzgerald-tonicsiteshop-com/home/screenshots/full/desktop.png"
      },
      {
        "type": "screenshot",
        "path": "scrapes/fitzgerald-tonicsiteshop-com/home/screenshots/full/mobile.png"
      }
    ]
  },
  "globals": {
    "header": {
      "id": "top-menu-black",
      "kind": "section",
      "role": "header",
      "sourcePattern": {
        "family": "editorial-header-nav",
        "label": "Editorial Header Nav",
        "confidence": 0.99,
        "cues": [
          "header/menu block slug"
        ]
      },
      "targetBlock": {
        "type": "header",
        "variant": 6,
        "navLayout": "split-brand-center"
      },
      "content": {
        "heading": "",
        "subheading": "fitzgerald",
        "paragraphs": [
          "fitzgerald"
        ],
        "buttons": [
          {
            "label": "fitzgerald",
            "url": "https://fitzgerald.tonicsiteshop.com/#/"
          },
          {
            "label": "Home",
            "url": "https://fitzgerald.tonicsiteshop.com/#/"
          },
          {
            "label": "About",
            "url": "https://fitzgerald.tonicsiteshop.com/about"
          }
        ]
      },
      "media": [],
      "style": {
        "backgroundColor": "rgba(0, 0, 0, 0)",
        "copyAlignment": "split",
        "backgroundImage": true
      },
      "notes": [
        "Generated from the Python foundation pipeline.",
        "Validate this mapper before final PHP bridge export."
      ]
    },
    "footer": {
      "id": "footer",
      "kind": "section",
      "role": "footer",
      "sourcePattern": {
        "family": "editorial-footer-nav",
        "label": "Editorial Footer Nav",
        "confidence": 0.99,
        "cues": [
          "footer block slug"
        ]
      },
      "targetBlock": {
        "type": "footer",
        "variant": 8
      },
      "content": {
        "heading": "© Tonic Site Shop 2024 | Site Credit",
        "subheading": "p",
        "paragraphs": [
          "p",
          "F",
          "Home",
          "About"
        ],
        "buttons": [
          {
            "label": "Site Credit",
            "url": "https://fitzgerald.tonicsiteshop.com/site-credit"
          },
          {
            "label": "Home",
            "url": "https://fitzgerald.tonicsiteshop.com/#/"
          },
          {
            "label": "About",
            "url": "https://fitzgerald.tonicsiteshop.com/about"
          }
        ]
      },
      "media": [
        {
          "slot": "primary",
          "url": "https://static.showit.co/270/aBHZ0eelQTy7oSYokVU4Pw/51489/tec_petaja_photography_lecollectif-21.jpg",
          "alt": "",
          "source": "showit"
        },
        {
          "slot": "image-2",
          "url": "https://static.showit.co/270/VHsjzl9XTNqByPPe0h_T6g/51489/tec_petaja_photography_lecollectif-28.jpg",
          "alt": "",
          "source": "showit"
        },
        {
          "slot": "image-3",
          "url": "https://static.showit.co/270/4D8sTbmRThqSpqHi3fC9Gw/51489/tec_petaja_photography_lecollectif-5.jpg",
          "alt": "",
          "source": "showit"
        },
        {
          "slot": "image-4",
          "url": "https://static.showit.co/270/7bvmLOGoQimD9sUGjKsxLw/51489/screen_shot_2024-04-17_at_10_55_19_am.png",
          "alt": "",
          "source": "showit"
        },
        {
          "slot": "image-5",
          "url": "https://static.showit.co/270/5HGF1XZ8S5K8taOe0J7ICw/51489/tec_petaja_photography_lecollectif-36.jpg",
          "alt": "",
          "source": "showit"
        },
        {
          "slot": "image-6",
          "url": "https://static.showit.co/270/ayYOwBu7TpizP6lwgDbnPQ/51489/tec_petaja_photography_lecollectif-18.jpg",
          "alt": "",
          "source": "showit"
        },
        {
          "slot": "image-7",
          "url": "https://static.showit.co/270/1sm11aFRTjuCjzgHvwLYpA/51489/6.jpg",
          "alt": "",
          "source": "showit"
        }
      ],
      "style": {
        "backgroundColor": "rgba(0, 0, 0, 0)",
        "copyAlignment": "split",
        "backgroundImage": true
      },
      "notes": [
        "Generated from the Python foundation pipeline.",
        "Validate this mapper before final PHP bridge export."
      ]
    }
  },
  "pages": [
    {
      "id": "home",
      "title": "TONIC's Fitzgerald Showit Website Template",
      "slug": "home",
      "sourceUrl": "https://fitzgerald.tonicsiteshop.com/",
      "sections": [
        {
          "id": "hero-with-alt-options",
          "kind": "section",
          "role": "hero",
          "sourcePattern": {
            "family": "editorial-hero-overlay",
            "label": "Editorial Hero Overlay",
            "confidence": 0.88,
            "cues": [
              "showit hero block slug"
            ]
          },
          "targetBlock": {
            "type": "hero",
            "variant": 5
          },
          "content": {
            "heading": "the NEW",
            "subheading": "Acclaimed international wedding film photography for the new romantics.",
            "paragraphs": [
              "Acclaimed international wedding film photography for the new romantics.",
              "Explore the Work",
              "Acclaimed International wedding film photography for the new romantics. For images as timeless as your story.",
              "F"
            ],
            "buttons": [
              {
                "label": "Explore the Work",
                "url": "https://fitzgerald.tonicsiteshop.com/portfolio"
              },
              {
                "label": "Explore the Work",
                "url": "https://fitzgerald.tonicsiteshop.com/portfolio"
              }
            ]
          },
          "media": [
            {
              "slot": "primary",
              "url": "https://static.showit.co/1600/RRr87m7tT3qx49LSSfitsg/51489/lecollectif-34_cropped.jpg",
              "alt": "",
              "source": "showit"
            },
            {
              "slot": "image-2",
              "url": "https://static.showit.co/1200/RRr87m7tT3qx49LSSfitsg/51489/lecollectif-34_cropped.jpg",
              "alt": "",
              "source": "showit"
            },
            {
              "slot": "image-3",
              "url": "https://static.showit.co/800/FJ8egnj1T1ygGKDm15XPsA/51489/lecollectif-48.jpg",
              "alt": "",
              "source": "showit"
            },
            {
              "slot": "image-4",
              "url": "https://static.showit.co/800/gWuMW6Q_QHaPRtMdTCa7sw/51489/lecollectif-102.jpg",
              "alt": "",
              "source": "showit"
            },
            {
              "slot": "image-5",
              "url": "https://static.showit.co/1200/KDUW18L7SBSEsMn8VFQW6A/51489/lecollectif-100.jpg",
              "alt": "",
              "source": "showit"
            },
            {
              "slot": "image-6",
              "url": "https://static.showit.co/1200/aBHZ0eelQTy7oSYokVU4Pw/51489/tec_petaja_photography_lecollectif-21.jpg",
              "alt": "",
              "source": "showit"
            },
            {
              "slot": "image-7",
              "url": "https://static.showit.co/1200/gkppDZWmR865guF6T_BY1g/51489/lecollectif-31.jpg",
              "alt": "",
              "source": "showit"
            },
            {
              "slot": "image-8",
              "url": "https://static.showit.co/file/nhA0kU9aRASa3Mckb9X9eg/51489/fp_mark_frame_white.svg",
              "alt": "",
              "source": "showit"
            }
          ],
          "style": {
            "backgroundColor": "rgba(0, 0, 0, 0)",
            "copyAlignment": "split",
            "backgroundImage": true
          },
          "notes": [
            "Generated from the Python foundation pipeline.",
            "Validate this mapper before final PHP bridge export."
          ]
        },
        {
          "id": "brand-bio",
          "kind": "section",
          "role": "content",
          "sourcePattern": {
            "family": "bio-band-with-portrait",
            "label": "Bio Band With Portrait",
            "confidence": 0.72,
            "cues": [
              "showit bio/about block slug"
            ]
          },
          "targetBlock": {
            "type": "content",
            "variant": 2
          },
          "content": {
            "heading": "We make timeless images for brides and grooms with classic style.",
            "subheading": "F",
            "paragraphs": [
              "F",
              "P",
              "Welcome to wedding photography done differently. Ut tbh nostrud succulents cillum waistcoat neutra labore reprehenderit gatekeep non readymade.",
              "Fitzgerald Weddings"
            ],
            "buttons": [
              {
                "label": "F",
                "url": "https://fitzgerald.tonicsiteshop.com/#/"
              },
              {
                "label": "P",
                "url": "https://fitzgerald.tonicsiteshop.com/#/"
              },
              {
                "label": "Fitzgerald Weddings",
                "url": "https://fitzgerald.tonicsiteshop.com/portfolio"
              }
            ]
          },
          "media": [
            {
              "slot": "primary",
              "url": "https://static.showit.co/800/WP0WEuu9RJOS9Elo46sqqg/51489/lecollectif-198.jpg",
              "alt": "",
              "source": "showit"
            },
            {
              "slot": "image-2",